{
  "training_successful": true,
  "audio_oracle_stats": {
    "total_patterns": 2036,
    "total_states": 260,
    "sequence_length": 259,
    "max_pattern_length": 50,
    "is_trained": true,
    "last_update": 1758475623.565417,
    "memory_usage": 259,
    "distance_threshold": 0.15,
    "distance_function": "euclidean",
    "feature_dimensions": 15,
    "adaptive_threshold": true,
    "total_distances_calculated": 0,
    "average_distance": 0.0,
    "threshold_adjustments": 0,
    "chord_progressions": 0,
    "harmonic_patterns": 0,
    "polyphonic_frames": 0,
    "chord_types": {},
    "average_pitches_per_frame": 0.0
  },
  "events_processed": 259,
  "transformer_analysis": {
    "key_signature": "C_major",
    "tempo_analysis": {
      "estimated_tempo": 140.0,
      "tempo_variation": 0.001208381843753159,
      "tempo_stability": 0.9987916350364685
    },
    "chord_progression": [],
    "musical_form": {
      "verse": 0.002551302080973983,
      "chorus": 0.08426511287689209,
      "bridge": 0.00021639624901581556,
      "intro": 0.010340581648051739,
      "outro": 0.06408658623695374,
      "solo": 0.7174587249755859,
      "break": 0.1127404049038887,
      "coda": 0.008340837433934212
    },
    "scale_analysis": {
      "C_major": 1.266361581570008e-12,
      "C_minor": 4.354641447434915e-08,
      "C#_major": 6.771608695999021e-07,
      "C#_minor": 8.180852972827779e-08,
      "D_major": 1.9072556034505084e-12,
      "D_minor": 4.551471612795899e-12,
      "D#_major": 0.0005752075230702758,
      "D#_minor": 5.624542498416929e-12,
      "E_major": 1.8024938697180914e-07,
      "E_minor": 0.000766692915931344,
      "F_major": 4.466581060569297e-08,
      "F_minor": 4.899871064445449e-10,
      "F#_major": 0.000664121937006712,
      "F#_minor": 3.086399802398887e-09,
      "G_major": 1.6778618601165363e-06,
      "G_minor": 5.497546862187619e-10,
      "G#_major": 6.739482216744364e-08,
      "G#_minor": 7.852847261347051e-08,
      "A_major": 0.997839093208313,
      "A_minor": 8.375602433829954e-09,
      "A#_major": 1.7490729697922092e-10,
      "A#_minor": 8.205618360079825e-05,
      "B_major": 6.548887176904827e-05,
      "B_minor": 4.377308414404979e-06
    },
    "confidence_scores": {
      "chord": 0.0,
      "scale": 0.5734517574310303,
      "form": 0.5734517574310303,
      "harmony": 0.5734517574310303,
      "melody": 0.5734517574310303,
      "rhythm": 0.5734517574310303
    }
  },
  "hierarchical_analysis": {
    "duration": 6.0,
    "hierarchical_structure": {
      "sections": 0,
      "phrases": 0,
      "measures": 0
    },
    "auditory_streams": [
      {
        "stream_id": 0,
        "start_time": 0.0,
        "end_time": 5.990748299319728,
        "stream_type": "melody",
        "confidence": -76.22462624332323
      },
      {
        "stream_id": 1,
        "start_time": 1.3003174603174603,
        "end_time": 5.38702947845805,
        "stream_type": "melody",
        "confidence": -125.696028609869
      },
      {
        "stream_id": 2,
        "start_time": 0.3250793650793651,
        "end_time": 5.851428571428571,
        "stream_type": "melody",
        "confidence": -198.98171889856337
      },
      {
        "stream_id": 3,
        "start_time": 0.09287981859410431,
        "end_time": 5.526349206349207,
        "stream_type": "melody",
        "confidence": -122.0122278399324
      },
      {
        "stream_id": 4,
        "start_time": 0.8359183673469388,
        "end_time": 5.340589569160998,
        "stream_type": "melody",
        "confidence": -226.0289600400098
      }
    ],
    "sampled_events_count": 259,
    "sampling_strategy": "hierarchical_adaptive"
  },
  "training_statistics": {
    "total_events": 259,
    "hierarchical_analysis_time": 2.079160213470459,
    "transformer_analysis_time": 1.2025296688079834,
    "audio_oracle_training_time": 17.668080806732178,
    "total_training_time": 0.0,
    "hierarchical_insights_applied": true,
    "enhancement_applied": true
  }
}