{
  "training_successful": true,
  "audio_oracle_stats": {
    "total_patterns": 3431,
    "total_states": 501,
    "sequence_length": 500,
    "max_pattern_length": 50,
    "is_trained": true,
    "last_update": 1758781544.510853,
    "memory_usage": 500,
    "distance_threshold": 0.019820274961085252,
    "distance_function": "euclidean",
    "feature_dimensions": 15,
    "adaptive_threshold": true,
    "total_distances_calculated": 126036,
    "average_distance": 0.039799999999999995,
    "threshold_adjustments": 1912,
    "harmonic_patterns": 7,
    "polyphonic_patterns": 1,
    "chord_progressions": 0,
    "rhythmic_patterns": 0,
    "musical_insights_used": 0,
    "polyphonic_frames": 0,
    "chord_types": {},
    "average_pitches_per_frame": 0.0
  },
  "events_processed": 500,
  "harmonic_patterns": 7,
  "polyphonic_patterns": 1,
  "sample_harmonic_patterns": [
    [
      [
        "C",
        "C"
      ],
      499
    ],
    [
      [
        "C",
        "C",
        "C"
      ],
      498
    ],
    [
      [
        "C",
        "C",
        "C",
        "C"
      ],
      497
    ],
    [
      [
        "C",
        "C",
        "C",
        "C",
        "C"
      ],
      496
    ],
    [
      [
        "C",
        "C",
        "C",
        "C",
        "C",
        "C"
      ],
      495
    ]
  ],
  "sample_polyphonic_patterns": [
    [
      "[{'stream_0': {'stream_id': 0, 'chord_tension': 0.5, 'rhythmic_density': 0.5, 'hierarchical_level': 'section_boundary'}, 'stream_1': {'stream_id': 1, 'chord_tension': 0.5, 'rhythmic_density': 0.5, 'hierarchical_level': 'section_boundary'}, 'stream_2': {'stream_id': 2, 'chord_tension': 0.5, 'rhythmic_density': 0.5, 'hierarchical_level': 'section_boundary'}, 'stream_3': {'stream_id': 3, 'chord_tension': 0.5, 'rhythmic_density': 0.5, 'hierarchical_level': 'section_boundary'}}, {'stream_0': {'stream_id': 0, 'chord_tension': 0.5, 'rhythmic_density': 0.5, 'hierarchical_level': 'section_boundary'}, 'stream_1': {'stream_id': 1, 'chord_tension': 0.5, 'rhythmic_density': 0.5, 'hierarchical_level': 'phrase_center'}, 'stream_2': {'stream_id': 2, 'chord_tension': 0.5, 'rhythmic_density': 0.5, 'hierarchical_level': 'section_boundary'}, 'stream_3': {'stream_id': 3, 'chord_tension': 0.5, 'rhythmic_density': 0.5, 'hierarchical_level': 'section_boundary'}}]",
      1
    ]
  ],
  "transformer_analysis": {
    "key_signature": "C_major",
    "tempo_analysis": {
      "estimated_tempo": 60.0,
      "tempo_variation": 0.0013220604741945863,
      "tempo_stability": 0.9986779689788818
    },
    "chord_progression": [],
    "musical_form": {
      "verse": 0.06265535950660706,
      "chorus": 0.0067777023650705814,
      "bridge": 0.07285049557685852,
      "intro": 0.8229751586914062,
      "outro": 0.00041416112799197435,
      "solo": 0.0037720140535384417,
      "break": 0.00876386184245348,
      "coda": 0.021791324019432068
    },
    "scale_analysis": {
      "C_major": 0.12744222581386566,
      "C_minor": 7.986444074958854e-07,
      "C#_major": 0.3002403974533081,
      "C#_minor": 5.655456103426104e-10,
      "D_major": 0.0002312157885171473,
      "D_minor": 0.009065872989594936,
      "D#_major": 2.855600769180455e-07,
      "D#_minor": 0.005378164350986481,
      "E_major": 4.1837098251562566e-05,
      "E_minor": 0.3496111035346985,
      "F_major": 0.008397300727665424,
      "F_minor": 5.495777166686366e-10,
      "F#_major": 1.655994765314972e-06,
      "F#_minor": 0.00026720884488895535,
      "G_major": 1.2033488872020826e-07,
      "G_minor": 1.3729560821573727e-09,
      "G#_major": 9.269571776826524e-09,
      "G#_minor": 0.007229733280837536,
      "A_major": 0.0018285128753632307,
      "A_minor": 3.2123887194757117e-06,
      "A#_major": 5.246256114332937e-05,
      "A#_minor": 1.0473411471423333e-08,
      "B_major": 0.19020789861679077,
      "B_minor": 4.4706545132555675e-09
    },
    "confidence_scores": {
      "chord": 0.0,
      "scale": 0.4565580189228058,
      "form": 0.4565580189228058,
      "harmony": 0.4565580189228058,
      "melody": 0.4565580189228058,
      "rhythm": 0.4565580189228058
    }
  },
  "hierarchical_analysis": {
    "duration": 183.6825850340136,
    "hierarchical_structure": {
      "sections": 2,
      "phrases": 20,
      "measures": 61
    },
    "auditory_streams": [
      {
        "stream_id": 0,
        "start_time": 0.37151927437641724,
        "end_time": 45.04671201814059,
        "stream_type": "melody",
        "confidence": -251.7379014287948
      },
      {
        "stream_id": 1,
        "start_time": 2.089795918367347,
        "end_time": 45.789750566893424,
        "stream_type": "melody",
        "confidence": -566.862713882839
      },
      {
        "stream_id": 2,
        "start_time": 0.09287981859410431,
        "end_time": 46.393469387755104,
        "stream_type": "melody",
        "confidence": -282.10328576859644
      },
      {
        "stream_id": 3,
        "start_time": 0.0,
        "end_time": 45.00027210884354,
        "stream_type": "melody",
        "confidence": -243.94580838735519
      },
      {
        "stream_id": 4,
        "start_time": 0.046439909297052155,
        "end_time": 45.186031746031745,
        "stream_type": "melody",
        "confidence": -355.9427966029676
      }
    ],
    "sampled_events_count": 500,
    "sampling_strategy": "hierarchical_adaptive"
  },
  "training_statistics": {
    "total_events": 500,
    "hierarchical_analysis_time": 5.09106707572937,
    "rhythmic_analysis_time": 0.0,
    "transformer_analysis_time": 1.0588469505310059,
    "audio_oracle_training_time": 9.02534031867981,
    "rhythm_oracle_training_time": 0.0,
    "total_training_time": 0.0,
    "hierarchical_insights_applied": true,
    "rhythmic_insights_applied": false,
    "enhancement_applied": true,
    "training_result": {
      "training_successful": true,
      "audio_oracle_stats": {
        "total_patterns": 3431,
        "total_states": 501,
        "sequence_length": 500,
        "max_pattern_length": 50,
        "is_trained": true,
        "last_update": 1758781544.510853,
        "memory_usage": 500,
        "distance_threshold": 0.019820274961085252,
        "distance_function": "euclidean",
        "feature_dimensions": 15,
        "adaptive_threshold": true,
        "total_distances_calculated": 126036,
        "average_distance": 0.039799999999999995,
        "threshold_adjustments": 1912,
        "harmonic_patterns": 7,
        "polyphonic_patterns": 1,
        "chord_progressions": 0,
        "rhythmic_patterns": 0,
        "musical_insights_used": 0,
        "polyphonic_frames": 0,
        "chord_types": {},
        "average_pitches_per_frame": 0.0
      },
      "events_processed": 500,
      "harmonic_patterns": 7,
      "polyphonic_patterns": 1,
      "sample_harmonic_patterns": [
        [
          [
            "C",
            "C"
          ],
          499
        ],
        [
          [
            "C",
            "C",
            "C"
          ],
          498
        ],
        [
          [
            "C",
            "C",
            "C",
            "C"
          ],
          497
        ],
        [
          [
            "C",
            "C",
            "C",
            "C",
            "C"
          ],
          496
        ],
        [
          [
            "C",
            "C",
            "C",
            "C",
            "C",
            "C"
          ],
          495
        ]
      ],
      "sample_polyphonic_patterns": [
        [
          "[{'stream_0': {'stream_id': 0, 'chord_tension': 0.5, 'rhythmic_density': 0.5, 'hierarchical_level': 'section_boundary'}, 'stream_1': {'stream_id': 1, 'chord_tension': 0.5, 'rhythmic_density': 0.5, 'hierarchical_level': 'section_boundary'}, 'stream_2': {'stream_id': 2, 'chord_tension': 0.5, 'rhythmic_density': 0.5, 'hierarchical_level': 'section_boundary'}, 'stream_3': {'stream_id': 3, 'chord_tension': 0.5, 'rhythmic_density': 0.5, 'hierarchical_level': 'section_boundary'}}, {'stream_0': {'stream_id': 0, 'chord_tension': 0.5, 'rhythmic_density': 0.5, 'hierarchical_level': 'section_boundary'}, 'stream_1': {'stream_id': 1, 'chord_tension': 0.5, 'rhythmic_density': 0.5, 'hierarchical_level': 'phrase_center'}, 'stream_2': {'stream_id': 2, 'chord_tension': 0.5, 'rhythmic_density': 0.5, 'hierarchical_level': 'section_boundary'}, 'stream_3': {'stream_id': 3, 'chord_tension': 0.5, 'rhythmic_density': 0.5, 'hierarchical_level': 'section_boundary'}}]",
          1
        ]
      ]
    }
  }
}